{
  "case_id": "case_02",
  "name": "Broken unit test",
  "held_out": false,
  "requested_ref": "v0.9.2",
  "expected_decision": "NO-GO",
  "blockers": [
    {
      "blocker_id": "failing_unit_test",
      "severity": "critical",
      "category": "tests",
      "description": "test_calculate_total_applies_tax_rate fails: calculate_total() adds the tax rate to the subtotal instead of multiplying, producing 100.2 instead of 120.0.",
      "match_any_of": [
        ["test", "failing"],
        ["test", "fails"],
        ["failing", "test"],
        ["calculate", "total", "tax"],
        ["test", "suite", "red"]
      ],
      "acceptable_evidence": [
        "test_report.json",
        "src/invoicing/billing.py",
        "tests/test_billing.py"
      ]
    }
  ],
  "acceptable_extra_findings": [
    {
      "category": "ci",
      "match_any_of": [
        ["no", "workflow", "run"],
        ["ci", "run", "missing"]
      ],
      "note": "Observation that no CI run exists for this ref is acceptable but should not itself be treated as the sole blocker."
    }
  ],
  "forbidden_findings": [
    {
      "match_any_of": [
        ["tests", "passing"],
        ["all", "tests", "pass"],
        ["tests", "green"]
      ],
      "note": "3 of 4 tests pass but one fails; a claim that all tests pass is false."
    }
  ],
  "notes": "Development case. Signal comes solely from test_report.json; github_actions_runs.json is empty for this ref."
}
